{"$schema":"https://json-schema.org/draft/2020-12/schema","$id":"https://vexil.dev/release/schemas/security-scan-1.0.schema.json","type":"object","additionalProperties":false,"required":["$schema","recordKind","schemaVersion","scanId","observedAt","scanner","scope","lockfileDigest","findings"],"properties":{"$schema":{"const":"https://vexil.dev/release/schemas/security-scan-1.0.schema.json"},"recordKind":{"const":"release-security-scan"},"schemaVersion":{"const":"1.0"},"scanId":{"type":"string","pattern":"^[a-z0-9][a-z0-9._-]*$"},"observedAt":{"type":"string","pattern":"^[0-9]{4}-[0-9]{2}-[0-9]{2}T[0-9]{2}:[0-9]{2}:[0-9]{2}Z$"},"scanner":{"enum":["npm-audit@2","govulncheck@v1.6.0"]},"scope":{"oneOf":[{"type":"object","additionalProperties":false,"required":["manifest","lockfile","exposure"],"properties":{"manifest":{"const":"packages/runtime-ts/package.json"},"lockfile":{"const":"packages/runtime-ts/package-lock.json"},"exposure":{"const":"build-test-release-chain"}}},{"type":"object","additionalProperties":false,"required":["manifest","lockfile","exposure","sourceCommit"],"properties":{"manifest":{"const":"packages/runtime-go/go.mod"},"lockfile":{"const":""},"exposure":{"const":"shipped-runtime"},"sourceCommit":{"pattern":"^[0-9a-f]{40}$"}}}]},"lockfileDigest":{"pattern":"^(sha256:[0-9a-f]{64}|none)$"},"findings":{"type":"array","items":{"type":"object","additionalProperties":false,"required":["id","package","severity","status","releaseRelevant"],"properties":{"id":{"type":"string","minLength":1},"package":{"type":"string","minLength":1},"severity":{"enum":["low","moderate","high","critical"]},"status":{"enum":["remediated","exception","remediation-required"]},"releaseRelevant":{"const":true}}}}}}
