{"$schema":"https://vexil.dev/release/schemas/security-scan-1.0.schema.json","findings":[],"lockfileDigest":"sha256:c28370110da531598d70f721eb21f7117a5040b80543439a48c53cc587b8547a","observedAt":"2026-07-26T18:26:00Z","recordKind":"release-security-scan","scanId":"npm-runtime-ts-2026-07-26","scanner":"npm-audit@2","schemaVersion":"1.0","scope":{"exposure":"build-test-release-chain","lockfile":"packages/runtime-ts/package-lock.json","manifest":"packages/runtime-ts/package.json"}}
